{
  "schemaVersion": 1,
  "recordType": "entity",
  "id": "state.work_orders.condition.satisfied",
  "kind": "state",
  "title": "Work-order condition satisfied state",
  "definition": "The visible existing-condition state selected when the native cached next-check result is true.",
  "applicability": {
    "buildIds": ["build.df.0.53.15-win64-steam-683c721d"]
  },
  "facts": [
    {
      "id": "label-and-color",
      "statement": "A true cached result renders the annotation Satisfied for next check in bright native green foreground index 2 on black background index 0.",
      "status": "accepted",
      "evidenceRefs": [{
        "evidenceId": "evidence.binary.rule-0003-condition-colors-683c721d",
        "selectors": ["0x14038c3c0", "0x140390a03"]
      }]
    },
    {
      "id": "annotation-only",
      "statement": "The satisfied attributes apply to the next-check annotation, not the row's operator, quantity, or item-description fragments.",
      "status": "accepted",
      "evidenceRefs": [{
        "evidenceId": "evidence.binary.rule-0003-condition-colors-683c721d",
        "selectors": ["0x14038c3c0"]
      }]
    }
  ],
  "uncertainties": [
    {
      "id": "corpus-proof",
      "statement": "The pinned corpus does not capture this condition with a true cached result."
    }
  ],
  "relationships": {
    "parents": ["control.work_orders.condition.existing_row"],
    "children": [],
    "dependencies": ["rule.0003.work-order-condition-status-color"],
    "rules": ["rule.0003.work-order-condition-status-color"],
    "flows": [],
    "controls": [],
    "assets": []
  },
  "requiredStates": [],
  "requiredCases": {
    "positive": ["A true cached result displays the exact satisfied annotation and all three color attributes."],
    "boundary": ["Only the annotation span is bright green; adjacent condition fragments retain their own attributes."],
    "counterexamples": ["The same row with a false cached result uses the unsatisfied state instead."]
  },
  "absenceGuards": ["Do not infer this state from the underlying inventory condition when the native cached result is unavailable."],
  "recorderRequirements": {
    "stateSlice": ["selected condition id", "cached true result", "character plane", "foreground plane", "background plane", "brightness plane"],
    "requiredFrames": ["Existing row with a true cached result and the complete next-check annotation span"]
  },
  "computedStatus": {
    "discovery": "scoped",
    "binaryEvidence": "binary-read",
    "corpusEvidence": "not-captured",
    "productMapping": "mapped-conflicting",
    "verification": "untested",
    "release": "not-shippable"
  }
}
